{
  "$schema": "../../schema/endpoint.schema.json",
  "id": "alarm.wireless_universal_transmitter.delete",
  "title": "Delete alarm wireless universal transmitter",
  "api": "command",
  "host": "vproconfig",
  "method": "POST",
  "path": "device/decommission",
  "effect": "delete",
  "params": {
    "device_id": {}
  },
  "request": {
    "body": {
      "deviceId": "{{device_id}}"
    }
  },
  "response": {
    "status": ["2xx"],
    "schema": {
      "type": "object",
      "properties": {
        "error": {
          "type": "string"
        }
      },
      "required": ["error"]
    },
    "example": {
      "error": ""
    }
  },
  "tags": ["alarm"],
  "notes": "Needs a real device on the org. Same request as alarm.panel.delete, alarm.keypad.delete, alarm.expander.delete, alarm.wireless_contact_sensor.delete, alarm.wireless_panic_button.delete; vCommander reads a different part of the response.",
  "source": {
    "from": "vCommander",
    "methods": ["delete_wireless_universal_transmitter"]
  },
  "updated": "2026-10-23"
}
