{
  "$schema": "../../schema/endpoint.schema.json",
  "id": "scenario.delete",
  "title": "Delete scenario",
  "api": "command",
  "host": "vcerberus",
  "method": "DELETE",
  "path": "access/v2/user/lockdowns/{{scenario_id}}",
  "effect": "delete",
  "params": {
    "scenario_id": {}
  },
  "response": {
    "status": ["2xx"],
    "schema": {
      "type": "object"
    },
    "example": {}
  },
  "tags": ["scenario"],
  "source": {
    "from": "vCommander",
    "methods": ["delete_scenario"]
  },
  "updated": "2026-10-23"
}
