{
  "$schema": "../../schema/endpoint.schema.json",
  "id": "alarm.wireless_universal_transmitter.list",
  "title": "List alarm wireless universal transmitters",
  "api": "command",
  "host": "vproconfig",
  "method": "POST",
  "path": "alarm_system/get_devices",
  "effect": "read",
  "params": {
    "alarm_system_id": {}
  },
  "request": {
    "body": {
      "alarmSystemId": "{{alarm_system_id}}"
    }
  },
  "response": {
    "status": ["2xx"],
    "schema": {
      "type": "object",
      "properties": {
        "devices": {
          "type": "array",
          "items": {
            "type": "object",
            "properties": {
              "id": {
                "type": ["string", "number", "boolean"]
              },
              "alarmSystemId": {
                "type": ["string", "number", "boolean"]
              },
              "name": {
                "type": ["string", "number", "boolean"]
              },
              "type": {
                "type": "string"
              },
              "verkadaDeviceConfig": {
                "type": "object",
                "properties": {
                  "serialNumber": {
                    "type": ["string", "number", "boolean"]
                  }
                },
                "required": ["serialNumber"]
              }
            },
            "required": ["alarmSystemId", "id", "name", "type"]
          }
        }
      },
      "required": ["devices"]
    },
    "example": {
      "devices": [
        {
          "id": "<wireless_universal_transmitter_id>",
          "alarmSystemId": "<alarm_system_id>",
          "name": "<wireless_universal_transmitter_name>",
          "type": "UNIVERSAL_TRANSMITTER",
          "verkadaDeviceConfig": {
            "serialNumber": "<serial_number>"
          }
        }
      ]
    }
  },
  "tags": ["alarm"],
  "notes": "Same request as alarm.panel.list, alarm.keypad.list, alarm.expander.list, alarm.wireless_contact_sensor.list, alarm.wireless_panic_button.list, alarm.wired_output.list, alarm.wired_input.list; vCommander reads a different part of the response.",
  "source": {
    "from": "vCommander",
    "methods": ["get_wireless_universal_transmitter", "get_wireless_universal_transmitter_all"]
  },
  "updated": "2026-10-23"
}
